{
  "entity": "Submission",
  "table": "submission",
  "comment": "A person's attempt at a course test.",
  "columns": [
    {
      "name": "campus_id",
      "type": "integer",
      "nullable": false,
      "primaryKey": true,
      "foreignKeys": [
        { "name": "Campus", "entity": "Campus", "column": "id", "relation": "encompases" },
        { "name": "Course_Person", "entity": "CoursePerson", "column": "campus_id", "relation": "submits" },
        { "name": "Course_Test", "entity": "CourseTest", "column": "campus_id", "relation": "has submission" }
      ],
      "comment": "Campus this submission belongs to."
    },
    {
      "name": "id",
      "type": "integer",
      "nullable": false,
      "primaryKey": true,
      "identity": true,
      "comment": "Surrogate identifier for the submission, auto-generated by the database."
    },
    {
      "name": "course_person_id",
      "type": "integer",
      "nullable": false,
      "foreignKeys": [
        { "name": "Course_Person", "entity": "CoursePerson", "column": "id", "relation": "submits" }
      ],
      "comment": "The course-person (person + course + role) this submission was made by."
    },
    {
      "name": "course_test_id",
      "type": "integer",
      "nullable": false,
      "foreignKeys": [
        { "name": "Course_Test", "entity": "CourseTest", "column": "id", "relation": "has submission" }
      ],
      "comment": "The test this submission is an attempt at. The course referenced by course_person_id and the course referenced by course_test_id must be the same course; that rule is not enforced at the database level, only expected of the data."
    },
    {
      "name": "submitted_time",
      "type": "datetime",
      "nullable": false,
      "comment": "Date and time the submission was made."
    },
    {
      "name": "submission_text",
      "type": "string",
      "length": 4000,
      "nullable": true,
      "comment": "Optional submitted answer text, capped at 4000 characters (SQL Server's largest non-MAX NVARCHAR size) rather than using the unbounded text type.",
      "shortDescription": "Nullable"
    },
    {
      "name": "attempt_number",
      "type": "integer",
      "nullable": false,
      "uniqueWith": ["campus_id", "course_person_id", "course_test_id"],
      "comment": "Which attempt this is for this course-person on this test (1st, 2nd, ...). Unique together with campus_id, course_person_id, and course_test_id: the same attempt number can't be recorded twice for the same course-person/test."
    },
    {
      "name": "score",
      "type": "integer",
      "nullable": false,
      "comment": "Score achieved on this attempt."
    }
  ]
}
