{
  "entity": "CurriculumType",
  "table": "curriculum_type",
  "comment": "Lookup table of allowed curriculum types for a course within a term (e.g. Mandatory, Optional), driving selectable values in the GUI rather than a hardcoded list.",
  "columns": [
    {
      "name": "code",
      "type": "string",
      "length": 30,
      "nullable": false,
      "primaryKey": true,
      "comment": "Stable, short machine-readable code for this curriculum type (e.g. MANDATORY), used directly as the primary key -- see CourseType for the reasoning behind lookup tables keyed on their natural code."
    },
    {
      "name": "display_name",
      "type": "string",
      "length": 100,
      "nullable": false,
      "unique": true,
      "comment": "Human-readable label shown in the GUI for this curriculum type."
    },
    {
      "name": "sort_order",
      "type": "integer",
      "nullable": false,
      "comment": "Determines display order in GUI lists (e.g. a dropdown), independent of code or alphabetical order."
    },
    {
      "name": "is_active",
      "type": "boolean",
      "nullable": false,
      "comment": "Whether this curriculum type is currently selectable for new term courses. A deactivated type stays valid for any existing row still referencing it; it just stops being offered as a choice for new ones."
    }
  ]
}
