{
  "entity": "CourseType",
  "table": "course_type",
  "comment": "Lookup table of allowed course delivery types (e.g. Online, In Person), driving selectable values in the GUI rather than a hardcoded list.",
  "columns": [
    {
      "name": "code",
      "type": "string",
      "length": 30,
      "nullable": false,
      "primaryKey": true,
      "comment": "Stable, short machine-readable code for this course type (e.g. IN_PERSON), used directly as the primary key since it's already the natural identifier -- a separate surrogate id would just be a second, unused key alongside it."
    },
    {
      "name": "display_name",
      "type": "string",
      "length": 100,
      "nullable": false,
      "unique": true,
      "comment": "Human-readable label shown in the GUI for this course type."
    },
    {
      "name": "sort_order",
      "type": "integer",
      "nullable": false,
      "comment": "Determines display order in GUI lists (e.g. a dropdown), independent of code or alphabetical order."
    },
    {
      "name": "is_active",
      "type": "boolean",
      "nullable": false,
      "comment": "Whether this course type is currently selectable for new courses. A deactivated type stays valid for any existing row still referencing it; it just stops being offered as a choice for new ones."
    }
  ]
}
