{
  "entity": "Course",
  "table": "course",
  "comment": "A course offered at a specific campus.",
  "columns": [
    {
      "name": "campus_id",
      "type": "integer",
      "nullable": false,
      "primaryKey": true,
      "foreignKeys": [
        { "name": "Campus", "entity": "Campus", "column": "id", "relation": "offers" }
      ],
      "comment": "Campus this course is offered at."
    },
    {
      "name": "id",
      "type": "integer",
      "nullable": false,
      "primaryKey": true,
      "identity": true,
      "comment": "Surrogate identifier for the course, auto-generated by the database."
    },
    {
      "name": "course_type",
      "type": "string",
      "length": 30,
      "nullable": false,
      "foreignKeys": [
        { "name": "Course_Type", "entity": "CourseType", "column": "code", "relation": "categorizes" }
      ],
      "comment": "How this course is delivered (e.g. In Person, Online) -- references course_type.code."
    },
    {
      "name": "name",
      "type": "string",
      "length": 200,
      "nullable": false,
      "comment": "Display name of the course."
    },
    {
      "name": "course_number",
      "type": "string",
      "length": 50,
      "nullable": false,
      "uniqueWith": ["campus_id"],
      "comment": "Human-readable course code, unique within its campus (the same code may be reused at a different campus).",
      "shortDescription": "External identification"
    },
    {
      "name": "description",
      "type": "text",
      "nullable": true,
      "comment": "Optional free-text description of the course."
    }
  ]
}
