{
  "entity": "CourseContent",
  "table": "course_content",
  "comment": "A piece of content (introduction, lecture, announcement, ...) belonging to a course.",
  "columns": [
    {
      "name": "campus_id",
      "type": "integer",
      "nullable": false,
      "primaryKey": true,
      "foreignKeys": [
        { "name": "Campus", "entity": "Campus", "column": "id", "relation": "encompases" },
        { "name": "Course", "entity": "Course", "column": "campus_id", "relation": "includes" }
      ],
      "comment": "Campus this course content belongs to."
    },
    {
      "name": "id",
      "type": "integer",
      "nullable": false,
      "primaryKey": true,
      "identity": true,
      "comment": "Surrogate identifier for the course content, auto-generated by the database."
    },
    {
      "name": "course_id",
      "type": "integer",
      "nullable": false,
      "foreignKeys": [
        { "name": "Course", "entity": "Course", "column": "id", "relation": "includes" }
      ],
      "comment": "Course this content item belongs to."
    },
    {
      "name": "content_type",
      "type": "string",
      "length": 30,
      "nullable": false,
      "foreignKeys": [
        { "name": "Course_Content_Type", "entity": "CourseContentType", "column": "code", "relation": "categorizes" }
      ],
      "comment": "Kind of content this is (e.g. Introduction, Lecture, Announcement) -- references course_content_type.code."
    },
    {
      "name": "ordering_position",
      "type": "integer",
      "nullable": false,
      "comment": "Explicit display order of this content item, independent of id or content_type."
    },
    {
      "name": "active",
      "type": "boolean",
      "nullable": false,
      "comment": "Whether this content item is currently shown."
    },
    {
      "name": "document_text",
      "type": "string",
      "length": 4000,
      "nullable": true,
      "comment": "Optional body text for this content item, capped at 4000 characters (SQL Server's largest non-MAX NVARCHAR size) rather than using the unbounded text type.",
      "shortDescription": "Nullable"
    }
  ]
}
