{
  "entity": "StudyProgram",
  "table": "study_program",
  "comment": "A program of study offered at a campus (e.g. a degree or certificate track).",
  "columns": [
    {
      "name": "campus_id",
      "type": "integer",
      "nullable": false,
      "primaryKey": true,
      "foreignKeys": [
        { "name": "Campus", "entity": "Campus", "column": "id", "relation": "offers" }
      ],
      "comment": "Campus this study program is offered at."
    },
    {
      "name": "id",
      "type": "integer",
      "nullable": false,
      "primaryKey": true,
      "identity": true,
      "comment": "Surrogate identifier for the study program, auto-generated by the database and unique across the whole system."
    },
    {
      "name": "code",
      "type": "string",
      "length": 50,
      "nullable": false,
      "uniqueWith": ["campus_id"],
      "comment": "Human-readable program code, unique within its campus (the same code may be reused at a different campus).",
      "shortDescription": "External identification"
    },
    {
      "name": "name",
      "type": "string",
      "length": 200,
      "nullable": false,
      "comment": "Display name of the study program."
    },
    {
      "name": "description",
      "type": "text",
      "nullable": true,
      "comment": "Optional free-text description of the study program."
    }
  ]
}
