{
  "entity": "Term",
  "table": "term",
  "comment": "A specific offering of a study program during a semester at a campus -- the thing courses actually get scheduled into.",
  "columns": [
    {
      "name": "campus_id",
      "type": "integer",
      "nullable": false,
      "primaryKey": true,
      "foreignKeys": [
        { "name": "Campus", "entity": "Campus", "column": "id", "relation": "schedules" },
        { "name": "Study_Program", "entity": "StudyProgram", "column": "campus_id", "relation": "schedules" }
      ],
      "comment": "Campus this term belongs to."
    },
    {
      "name": "id",
      "type": "integer",
      "nullable": false,
      "primaryKey": true,
      "identity": true,
      "comment": "Surrogate identifier for the term, auto-generated by the database and unique across the whole system."
    },
    {
      "name": "study_program_id",
      "type": "integer",
      "nullable": false,
      "foreignKeys": [
        { "name": "Study_Program", "entity": "StudyProgram", "column": "id", "relation": "schedules" }
      ],
      "comment": "Study program this term is an offering of."
    },
    {
      "name": "semester_type",
      "type": "string",
      "length": 30,
      "nullable": false,
      "foreignKeys": [
        { "name": "Semester_Type", "entity": "SemesterType", "column": "code", "relation": "categorizes" }
      ],
      "comment": "Which semester type this is (e.g. Winter, Summer) -- references semester_type.code."
    },
    {
      "name": "academic_year",
      "type": "integer",
      "nullable": false,
      "comment": "Academic year this semester falls in (e.g. 2026)."
    }
  ]
}
