{
  "entity": "Campus",
  "table": "campus",
  "comment": "A physical or virtual location where courses are offered.",
  "columns": [
    {
      "name": "id",
      "type": "integer",
      "nullable": false,
      "primaryKey": true,
      "identity": true,
      "comment": "Surrogate identifier for the campus, auto-generated by the database."
    },
    {
      "name": "uuid",
      "type": "string",
      "length": 36,
      "nullable": false,
      "unique": true,
      "comment": "Stable external identifier for the campus (e.g. for APIs/integrations), independent of the internal auto-generated id."
    },
    {
      "name": "code",
      "type": "string",
      "length": 20,
      "nullable": false,
      "unique": true,
      "comment": "Short, human-memorable static code for the campus, unique system-wide -- unlike id (not static) or uuid (unique but not memorable)."
    },
    {
      "name": "name",
      "type": "string",
      "length": 200,
      "nullable": false,
      "comment": "Display name of the campus."
    },
    {
      "name": "description",
      "type": "text",
      "nullable": true,
      "comment": "Optional free-text description of the campus."
    }
  ]
}
