{
  "entity": "TermCourse",
  "table": "term_course",
  "comment": "A course scheduled within a specific term, with a curriculum type (e.g. Mandatory, Optional) for that term.",
  "columns": [
    {
      "name": "campus_id",
      "type": "integer",
      "nullable": false,
      "primaryKey": true,
      "foreignKeys": [
        { "name": "Campus", "entity": "Campus", "column": "id", "relation": "consists of" },
        { "name": "Course", "entity": "Course", "column": "campus_id", "relation": "is scheduled in" },
        { "name": "Term", "entity": "Term", "column": "campus_id", "relation": "consists of" }
      ],
      "comment": "Campus this term course belongs to."
    },
    {
      "name": "id",
      "type": "integer",
      "nullable": false,
      "primaryKey": true,
      "identity": true,
      "comment": "Surrogate identifier for the term course, auto-generated by the database."
    },
    {
      "name": "term_id",
      "type": "integer",
      "nullable": false,
      "foreignKeys": [
        { "name": "Term", "entity": "Term", "column": "id", "relation": "consists of" }
      ],
      "comment": "Term this course is scheduled into."
    },
    {
      "name": "course_id",
      "type": "integer",
      "nullable": false,
      "foreignKeys": [
        { "name": "Course", "entity": "Course", "column": "id", "relation": "is scheduled in" }
      ],
      "uniqueWith": ["campus_id", "term_id"],
      "comment": "Course being scheduled. Unique together with campus_id and term_id: the same course can't be scheduled twice into the same term."
    },
    {
      "name": "curriculum_type",
      "type": "string",
      "length": 30,
      "nullable": false,
      "foreignKeys": [
        { "name": "Curriculum_Type", "entity": "CurriculumType", "column": "code", "relation": "categorizes" }
      ],
      "comment": "Whether this course is mandatory or optional within the term -- references curriculum_type.code."
    }
  ]
}
