{
  "entity": "CoursePerson",
  "table": "course_person",
  "comment": "A person's role (student, instructor, owner) on a course.",
  "columns": [
    {
      "name": "campus_id",
      "type": "integer",
      "nullable": false,
      "primaryKey": true,
      "foreignKeys": [
        { "name": "Campus", "entity": "Campus", "column": "id", "relation": "encompases" },
        { "name": "Course", "entity": "Course", "column": "campus_id", "relation": "is involved in" },
        { "name": "Person", "entity": "Person", "column": "campus_id", "relation": "is involved in" }
      ],
      "comment": "Campus this course person belongs to."
    },
    {
      "name": "id",
      "type": "integer",
      "nullable": false,
      "primaryKey": true,
      "identity": true,
      "comment": "Surrogate identifier for the course person, auto-generated by the database."
    },
    {
      "name": "course_id",
      "type": "integer",
      "nullable": false,
      "foreignKeys": [
        { "name": "Course", "entity": "Course", "column": "id", "relation": "is involved in" }
      ],
      "comment": "Course this role applies to."
    },
    {
      "name": "person_id",
      "type": "integer",
      "nullable": false,
      "foreignKeys": [
        { "name": "Person", "entity": "Person", "column": "id", "relation": "is involved in" }
      ],
      "uniqueWith": ["campus_id", "course_id"],
      "comment": "Person holding this role. Unique together with campus_id and course_id: the same person can't be given the same role assignment on the same course twice."
    },
    {
      "name": "course_role",
      "type": "string",
      "length": 30,
      "nullable": false,
      "foreignKeys": [
        { "name": "Course_Person_Role", "entity": "CoursePersonRole", "column": "code", "relation": "categorizes" }
      ],
      "comment": "Role this person holds on the course (e.g. Student, Instructor, Owner) -- references course_person_role.code."
    }
  ]
}
